{
  "schema_version": "1.0.0",
  "job_id": "job-repair01",
  "job_type": "REPAIR",
  "status": "SUCCEEDED",
  "trace_id": "trace-020",
  "created_at": "2026-09-20T12:00:00Z",
  "updated_at": "2026-09-20T12:00:58Z",
  "input": {
    "repository": {
      "url": "git@github.com:<OWNER>/<PROJECT>.git",
      "commit": "<C0_FULL_40_SHA>"
    },
    "md_report_uri": "artifact://pair10/job-full01/md_report.json",
    "makefile_uri": "artifact://pair10/job-full01/Makefile",
    "build": {
      "command": "make",
      "verify_command": "make check"
    },
    "options": {
      "style_hint": "preserve-tab-indent",
      "max_candidates": 3
    }
  },
  "execution": {
    "mode": "ASYNC",
    "timeout_seconds": 300,
    "started_at": "2026-09-20T12:00:00Z",
    "finished_at": "2026-09-20T12:00:58Z",
    "attempt": 1,
    "command": "make check",
    "resources": { "cpu": 2, "memory_mb": 2048 }
  },
  "output": {
    "git_patch_uri": "artifact://pair10/job-repair01/fix.patch",
    "patch_meta": {
      "files_changed": ["Makefile"],
      "lines_added": 3,
      "lines_removed": 0,
      "style": "tab-indent"
    },
    "applied_findings": [
      {
        "type": "MISSING",
        "target": "src/main.o",
        "dependency": "include/config.h",
        "fix_strategy": "append-dep-to-prerequisite"
      }
    ],
    "rejected_candidates": [],
    "recheck": {
      "build_log_uri": "artifact://pair10/job-repair01/build.log",
      "build_exit_code": 0,
      "verify_log_uri": "artifact://pair10/job-repair01/verify.log",
      "verify_exit_code": 0
    },
    "stats": {
      "duration_sec": 58,
      "candidates_generated": 1,
      "candidates_rejected": 0
    }
  }
}
