{
  "schema_version": "1.0.0",
  "job_id": "job-full01",
  "job_type": "FULL_CHECK",
  "status": "RUNNING",
  "trace_id": "trace-001",
  "created_at": "2026-09-20T10:00:00Z",
  "updated_at": "2026-09-20T10:00:47Z",
  "input": {
    "repository": {
      "url": "git@github.com:<OWNER>/<PROJECT>.git",
      "commit": "<C0_FULL_40_SHA>"
    },
    "build": {
      "command": "make",
      "project_root": "./"
    },
    "configuration_id": "cc-MODE0",
    "options": {
      "include_redundant": true,
      "max_jobs": 8
    }
  },
  "output": {
    "progress": {
      "phase": "building",
      "step": "make src/main.o",
      "percent": 62
    },
    "stats": {
      "duration_sec": 47
    }
  }
}
