{
  "schema_version": "1.0.0",
  "job_id": "job-incr01",
  "job_type": "INCREMENTAL_CHECK",
  "status": "SUCCEEDED",
  "trace_id": "trace-003",
  "created_at": "2026-09-20T11:00:00Z",
  "updated_at": "2026-09-20T11:02:10Z",
  "input": {
    "repository": {
      "url": "git@github.com:<OWNER>/<PROJECT>.git",
      "commit": "<C1_FULL_40_SHA>"
    },
    "baseline": {
      "commit": "<C0_FULL_40_SHA>",
      "configuration_id": "cc-MODE0",
      "actual_graph_uri": "artifact://pair10/job-full01/actual.json"
    },
    "build": { "command": "make", "project_root": "./" }
  },
  "execution": {
    "mode": "ASYNC",
    "timeout_seconds": 300,
    "started_at": "2026-09-20T11:00:00Z",
    "finished_at": "2026-09-20T11:02:10Z",
    "attempt": 1,
    "command": "make",
    "resources": { "cpu": 2, "memory_mb": 2048 }
  },
  "output": {
    "artifacts": [
      {
        "artifact_id": "actual-002", "type": "ACTUAL_GRAPH",
        "uri": "artifact://pair10/job-incr01/actual.json", "media_type": "application/json",
        "producer_job_id": "job-incr01",
        "sha256": "5d0939adc0c96f6bda7570bd92a1d2aba499ad0d010a72883d8989f25f1d7ed9"
      }
    ],
    "delta": {
      "new_findings": [
        {
          "type": "MISSING",
          "target": "src/util.o",
          "dependency": "include/utils.h",
          "detector": "ECHECKER",
          "evidence": { "file": "src/util.c", "line": 5 }
        }
      ],
      "eliminated_findings": [
        {
          "type": "REDUNDANT",
          "target": "src/legacy.o",
          "dependency": "include/old.h",
          "detector": "ECHECKER"
        }
      ]
    }
  }
}
